{
  "id": "common",
  "name": "Общий режим",
  "description": "General safe profile",
  "status": "experimental",
  "version": "1.0.0",
  "targets": ["web"],
  "health_checks": ["dns", "tcp", "https"],
  "engine_profile_ref": "common-default",
  "fallback_profiles": ["common-safe"],
  "risk_level": "low",
  "notes": "No low-level strategy values in initial scaffold"
}
